{"schema_version":"pysolate.problem.v1","source_sha256":"sha256:96471d39c04f3382696a858021bcb83f675f274a6d7de1f2450057e82beec71a","generated_at_policy":"omitted","problem_id":"problem-private","code":"object_unavailable","severity":"info","scope":"reference","run_id":"run-private","ref_sha256":"sha256:752ac3e6cfb6c4409613e95921574fea785842cef8d1299eaa12733005cafd95"}